<?xml version="1.0" encoding="utf-8"?>
<calibration xmlns:xsi="http://www.w3.org/2001/XMLSchema-instance" xsi:noNamespaceSchemaLocation="calibration.xsd">
   <algorithm>
      <simulatedAnnealing>
         <noEpsilon>4</noEpsilon>
         <rt>0.3</rt>
         <T>200000</T>
         <NS>15</NS>
         <NT>5</NT>
         <epsilon>1.E-5</epsilon>
         <maxNoEval>200000</maxNoEval>
      </simulatedAnnealing>
   </algorithm>
   <NMSmodel>
      <type>
         <openLoop/>
      </type>
      <tendon>
         <equilibriumElastic/>
      </tendon>
      <activation>
         <exponential/>
      </activation>
   </NMSmodel>
   <calibrationSteps>
      <step>
         <dofs>hip_flexion_r hip_adduction_r hip_rotation_r knee_flexion_r ankle_angle_r hip_flexion_l hip_adduction_l hip_rotation_l knee_flexion_l ankle_angle_l</dofs>
         <objectiveFunction>
            <torqueErrorNormalised>
               <targets>all</targets><!--<targetsType></targetsType>-->
               <weight>1</weight>
               <exponent>1</exponent>
            </torqueErrorNormalised>
            <penalty>
               <targets>all</targets>
               <targetsType>normalisedFibreLength</targetsType>
               <weight>100</weight>
               <exponent>2</exponent>
               <range>0.6 1.4</range>
            </penalty>
         </objectiveFunction>
         <parameterSet>
            <parameter>
               <name>c1</name>
               <single/>
               <absolute>
                  <range>-0.95 -0.05</range>
               </absolute>
            </parameter>
            <parameter>
               <name>c2</name>
               <single/>
               <absolute>
                  <range>-0.95 -0.05</range>
               </absolute>
            </parameter>
            <parameter>
               <name>shapeFactor</name>
               <single/>
               <absolute>
                  <range>-2.999 -0.001</range>
               </absolute>
            </parameter>
            <parameter>
               <name>tendonSlackLength</name>
               <single/>
               <relativeToSubjectValue>
                  <range>0.85 1.15</range>
               </relativeToSubjectValue>
            </parameter>
            <parameter>
               <name>optimalFibreLength</name>
               <single/>
               <relativeToSubjectValue>
                  <range>0.85 1.15</range>
               </relativeToSubjectValue>
            </parameter>
            <parameter>
               <name>strengthCoefficient</name>
               <single/>
               <absolute>
                  <range>0.8 2</range>
               </absolute>
            </parameter>
         </parameterSet>
      </step>
   </calibrationSteps>
   <trialSet>E:\3-PhD\Data\MocapData\ElaboratedData\009\pre\ceinms\trials\Run_baseline1.xml E:\3-PhD\Data\MocapData\ElaboratedData\009\pre\ceinms\trials\Run_baseline2.xml</trialSet>
</calibration>